<?xml version="1.0" encoding="UTF-8"?>
<!DOCTYPE unions SYSTEM "unions.dtd">


<unions>
    <union id="a53" language="fr" country="UK">
        <name>CGT</name>
        <number-affiliated>1200</number-affiliated>
        <headquarter>C/ Trévere 25</headquarter>
        <sectors>
            <sector>
                <name>Enseñanza&lt;Secundaria&gt;</name>
                <!-- Enseñanza<Secundaria> -->
                <city>&city;</city>
            </sector>
        </sectors>
        <spokesperson>Víctor</spokesperson>
    </union>
    <union id="a54" language="es">
        <name>CCOO</name>
        <number-affiliated>1300</number-affiliated>
        <headquarter>C/ Pez 8</headquarter>
        <sectors>
            <sector>
                <name>Enseñanza</name>
                <city>Madrid</city>
            </sector>
        </sectors>
        <spokesperson>Víctor</spokesperson>
    </union>
    <union id="e53" language="en" country="UK">
        <number-affiliated>1200</number-affiliated>
        <headquarter>C/ Trévere 25</headquarter>
        <sectors>
            <sector>
                <name>Enseñanza&lt;Secundaria&gt;</name>
                <!-- Enseñanza<Secundaria> -->
                <city>&city;</city>
            </sector>
        </sectors>
        <spokesman>Víctor</spokesman>
        <spokesperson>Otro</spokesperson>
    </union>
</unions>